{
  "layout_version": 1,
  "content_id": "11111111-1111-4111-8111-111111111111",
  "version_id": "aaaaaaa1-0000-4000-8000-000000000002",
  "rendition_id": "bbbbbbb1-0000-4000-8000-000000000003",
  "content_version": 2,
  "producer": {
    "kind": "build",
    "id": "ccccccc1-0000-4000-8000-000000000001"
  },
  "created_at": "2026-09-17T17:20:31Z",
  "files": []
}
