{
  "layout_version": 1,
  "content_id": "11111111-1111-4111-8111-111111111111",
  "version_id": "aaaaaaa1-0000-4000-8000-000000000002",
  "rendition_id": "bbbbbbb1-0000-4000-8000-000000000001",
  "content_version": 2,
  "producer": {
    "kind": "build",
    "id": "ccccccc1-0000-4000-8000-000000000001"
  },
  "created_at": "2026-09-17T17:20:31Z",
  "files": [
    {
      "path": "index.html",
      "size": 32,
      "sha256": "90572d4be39c3e0ce5e8a2db3499165267d2743669a3cc9da683fec2eef229af",
      "media_type": "text/html"
    },
    {
      "path": "styles.css",
      "size": 6,
      "sha256": "7c98040a541657584690ae2a1cc3b42a8b53b159cc60c5d3abbfecbaeac6c94a",
      "media_type": "text/css"
    },
    {
      "path": "assets/logo.png",
      "size": 8,
      "sha256": "4c4b6a3be1314ab86138bef4314dde022e600960d8689a2c8f8631802d20dab6",
      "media_type": "image/png"
    }
  ]
}
